<?xml version="1.0" encoding="UTF-8"?>
<!--
xml配置文件是用来描述界面组件的关系,对应节点的定义请参照xsd文件
引用 http://www.freeformatter.com/xsd-generator.html
     http://www.w3schools.com/schema/schema_elements_ref.asp
     http://www.opinionatedgeek.com/DotNet/Tools/HTMLEncode/encode.aspx
-->

<Transportation
    xmlns:xsi='http://www.w3.org/2001/XMLSchema-instance'
    xsi:noNamespaceSchemaLocation='../schema/TransportationSchema.xsd'>
    <server>
        <host>10.10.1.14</host>
        <port>6973</port>
        <timeout>20</timeout>
    </server>
    <registration>
        <prsCode>sanlogin</prsCode>
        <terminalID>10455843</terminalID>
        <token>usjdfjksa75ks832okudsjd94877akjdua</token>
        <unionPayID>947341249002001</unionPayID>
        <branchno>{"HospitalId":"2301","CAOZUOYDM":"AUTO1","CAOZUOYXM":"zizhuji1"}</branchno>
        <heartbeat>600000</heartbeat> 
    </registration>
    <misc>
    	
    	<!--<watchDog enabled="true">
            <checkInterval>10</checkInterval>
        </watchDog> -->
        <bankCardPrefix>
            622953
            621778
            621526 
        </bankCardPrefix>
    </misc>
</Transportation>
